field,question
law,"Writing a screenplay; need help figuring out if it makes sense.The main character is a package thief. She steals a package that ends up being human remains sold to a cannibal. If she were to go to the police, would they still arrest her for stealing the package? I guess it doesn't really matter cause I can just write it so the guy selling the meat lies and says she would still get arrested but I'm still curious about what would happen so maybe I can use it to help write my ending.
Thank you!"
law,"Hypothetically speaking, how would you file a lawsuit and/or police report against a religious group who wont leave you alone?."
law,"If you implant a functional baboon uterus inside someone who assaulted you, and remotely induced it, how badly can you get charged if he/she (and the baboon baby) lives?."
law,Wrongful termination?.I'm currently 18wks pregnant and have been extremely sick in and out of hospital and drs. I let my employers know the situation and they were very understanding in the beginning.  Due to my condition my attendance suffered at work and they terminated me this morning. Is this legal in NYS?
law,"I got scammed on OfferUp.I bought a computer on OfferUp. It was supposed to work. After I payed 750$ cash and brought it home, I realized it didn’t work and the seller isn’t responding. 

What can I do?"
law,"""Assault Weapon"" Cases.Some states such as CA or NY unfortunately have laws against certain types of rifles that have features liberal politicians have deemed scary/evil. 

1) Is there any precedent for AW cases or have all the defendants taken plea deals? 

2)Are things like forward protruding grip or telescoping stock legally defined?"
law,"Accidental assisted suicide?.A few buddies of mine were talking earlier and an interesting theoretical topic came to light, so imagine someone was drinking and their friend made them laugh causing them to choke/drown on their beverage ultimately causing their death. What would this be categorized as? An accident, a murder, a suicide? Would the joke maker be to blame for the drinkers death, legally speaking? Is there a name for this kind of event? "
law,"Job hiring female candidates only?.Hi all, fish and chip shop near me is hiring “female candidates only”

I’m not sure why there’s no reason given, but is this legal? Is there not a case of sex discrimination here? I’m not actually bothered but I saw it and it got me thinking from a legal perspective.

Thanks all!"
law,How to get around COPPA?.I run a YouTube page for nerf guns which is normally directed to tweens and teens but some can be directed to kids. My content though is about modded nerf blasters which are not for kids but COPPA wouldn’t see it that way. Is there any way to get around this like excessive cussing or something like that. I want to keep monetisation keep what I’m doing the same and not get fined 42k. Help.
law,"Employer mailed my (and others) 1095-C to the wrong addresses..While the details of how this happened is not clear let, is there any legal liability regarding this? The document contains name, address, SSN.

The employer also states they are going to purchase a 1-year identify protection service for all affected. That seems in some sense good faith, but also feels like is an effort to down play the gravity of the situation."
law,"I’ve heard of a sneaky vote the GOP did in North Carolina to override a veto, how can a vote pass if quorum is not met and the required majority of the house doesn’t vote yes?.I’ve heard about this going on in North Carolina, but it doesn’t even sound possible so I don’t understand. 

How can a veto for a bill pass if the majority of the house in question doesn’t vote yes, or if quorum isn’t met?"
law,How common is it to plead guilty to crimes you didn't commit?.
law,"spousal support in Illinois, Do I have to pay support before a court order."
law,Spouse being served divorce papers. Are they typically concealed in envelope or “naked” documents where bystanders could read it?.See title. Curious if papers are usually concealed in envelope
law,"Father just passed away - Need help finding bank accounts under his name..As the title states, my father just passed away. Although the did have a will, he didn't list the bank accounts or brokerage accounts he had under his name. (Based in California)

I was wondering if anyone knows of an efficient way that I can go about finding out this info. 

Thank you again for your anticipated help in this matter."
law,oklahoma : why would someone charged with felony domestic abuse and assault with deadly weapon get 5 preliminary hearing conferences while the entire time not doing any jail time ?.
law,i got nude scammed.i have done the terrible error of send nudes to strangers and they held me hostage because of it with my nudes and threaten to send to all my friends. i have sent them money through paypal and btc. i was very stressed at the moment and i understand that wasnt the best option. how should i act now?
law,Do the police ask professional people to consult on cases like in TV shows?.
law,Dual criminality.Is dual criminality a requirement to enforce a foreign court judgment on US soil ?
law,"I had a letter asking for my license.I had a letter asking for my driving license and saying I have to go to court as I have 12 points on my license now.

How long will it take for the court summons and am I allowed to drive in the meantime?"
law,"Is it lawfully OK to restrict access to Trump-owned properties?.Demonstrating peacefully on the streets is OK, given protesters get advance permission. Lawfully, are actions like - similar to striking - restricting access to Trump-owned properties legal, assuming that to do so would entail physically pushing someone aside, ie Battery?"
law,"Fall in love with a client?.Have you ever fallen in love with a client? If so, can you start a relationship once your legal services are no longer needed? Or is it unethical to date someone who used to be a client?"
law,Why is speaking about jury nullification illegal?.
law,"One- and two-party state recorded calls?.Suppose I'm in a one-party recording state, and someone from a two-party state calls me. If I record the call in my own state, am I breaking the law? If not, would that recording later be admissible in court in a two-party state?"
law,"Cease and desists letter.I received a cease and desists of all harassment letter in my email from my ex GF, I haven’t had contact with her since Sunday (when we broke up) but I told her friends some information my ex wouldn’t want them to know. Should I sign it? Technically I haven’t said a word since Sunday to her so I don’t know how if I should sign it, but I know she’s been in contact with the people I told the information too. I’m in Massachusetts if that matters"
law,"Assault question. Who's the guilty one?.As seen here https://www.reddit.com/r/JusticeServed/comments/7wln0m/annoying_guy_gets_what_he_deserves/

Wouldn't the guy in the purple shirt be guilty of assault to begin with? The statue dude didn't want to be touched and slapped, obviously."
law,"Common Law: Defamation. Can a Def escape liability for defamation if a re-publisher is not named as the co defendant?.Question is as above. Couldn't find anything on Lexis, maybe I'm throwing in irrelevant word searches. Any help would be appreciated, thanks!"
law,"Looking for starting point.I recently had an experience at work that has given me a business idea. It is totally unrelated to my job function and the business would not create competition with my employer.

I'm hoping to start it off as a side project to present to my employer as a way to gain credentials. I'm looking for some advice to protect the intellectual property. What should I look for in the employee manual? Should I only work on it off the clock?"
law,"(US) Could China's social credit score system come to America?.Could the social credit score system like they have in China come to the United States?

Go research it if you've never heard of it before."
law,"Property Rights Before Probate.If a will has not yet been probated and there is no personal representative, is there a legal repercussion to someone who is not insured or not listed on a car's registration or title driving the car?"
law,"Can you travel with 2 passports?.Let s say you have dual citizienship within USA and UK, two passports, one as US one as UK

You leave the USA using the US passport, and go to UK.

You enter to USA using the UK Passport

How does that work?"
law,"Can a bartender get in trouble for over serving coworker?.If a bartender gave shots to their friend at work, while they were working (so not a patron) and that person gets into an accident, can the bartender get in trouble for over serving them as they would if they over served a patron?"
law,"Canada - Selling other people's feet pics.I have an idea - selling feet pictures I downloaded off google images, but never saying they're MY feet pics. Would it be illegal?"
law,First time charge of larceny.A grocery store has pressed larceny charges against me. The total of the items came to around 88$. I have never gotten charged with anything else. Do I need a lawyer? Or will I be assigned an attorney? How can I expect court to go? I did not get arrested.
law,How can Florida pass a 6 week abortion ban when they have a right to privacy in their state constitution?.
law,what is the meaning and importance of the Preamble of the Philippines for you?.
law,"Employer withdrew from my account???.For the last 6 weeks my previous employer was continuing paying me despite not working there anymore, but yesterday they withdrew all pay leaving me a hefty overdraft fee in my checking account and almost draining my savings account . Is this legal? Is there anything I can do?"
law,Bail enforcement agent.Sorry if this is the wrong place to post this! I am trying to get into bail enforcement but I'm having trouble finding info on the subject. Are there any resources or is anyone involved in bail enforcement that would be willing to give me a hand getting started?
law,"Law that support restriction.Question , from Washington State RCW [26.09.191.3](https://26.09.191.3)(c) can the courts continue this restriction after the child turns 18 ?  What law would allow this restriction too exists after child turns 18 but he is AIP.  Child now an adult under the Guardianship Laws, where is this restriction or Law found?"
law,"If a child is removed from a home, can they return to and live in that home as an adult?."
law,Poll.is it harder to depose a witness wearing a mask 😷?
law,"If I stood naked at my door, is it classed as public indecency?.Hello, so me and my partner have had a debate about whether it would class as public indecency or not. We aren’t planning on doing it fyi, just curious if so we were to answer the door and people saw us stood there naked but we were in our home, is it a criminal offence?"
law,"Is it legal for teachers to make students write a ""trump cheated impeachment"" paper."
law,"Can a landlord do this?.My friend and I signed a lease for an apartment with a move in date for mid-August. It was also signed by the landlord. We got renters insurance as required, set up an appointment for electric, etc. On June 26, the landlord calls and tells us the apartment is no longer available because the tenant is no longer leaving. 

They can do that?! We’re in Mass, if that helps any."
law,What happens when a judge takes a sick day?.
law,"What kind of court for a name change?.I'm looking for a name change court in Cass County MO but don't know what to look for. I've seen justice courts but that seems like civil and criminal cases exclusively. 

Can anyone help me find what court to use? I'm trying to get my name changed legally for Christmas."
law,"Warrant vs subpoena.I had a friend today tell me that during her divorce her ex-husband asked for HER journal. He 
subpoenaed it and if she didnt give it to the court she would of been in Contempt of the court and sent to jail. I asked her about the 4th and 5th amendment and she responded by saying since it's not a criminal case you have to give the evidence. 
My question is, can a court really tell you you HAVE to give them something personal without a warrant? or is a subpoena just as good?"
law,"How well defined is the definition of commercial, for the purposes of Creative Commons licenses?.How well defined is the definition of commercial, for the purposes of Creative Commons licenses? 

I've heard it's not well defined."
law,Knife legality.I just recently bought a spring assisted folding pocket knife and am curious of the legality of it. Can I carry this out in public in my pocket legally? Is there anything illegal about having it on my person? I am 15 years old.
law,"What could the public do to stop a abuse of power (murder) being committed by a LEO?.This question was raised in r/askreddit about the George Floyd case.. and they’re wasn’t much response from actual acting law enforcement.. what could a concerned and brave citizen do to actually save a life in a situation like that.
Thanks,"
law,What is the most neutral subreddit discussing law?.
law,When is an independent contractor an employee?.In mma fighters are independent contractors despite not being allowed to fight for other organisations. If I hire an electrician we have a contract for them to do a certain job but I have no control over what other jobs they take in their free time as they aren't an employee so shouldn't fighters be in the same situation?
law,"If a woman feigns ignorance about who the father of her baby is, could the baby's father subsequently adopt this baby as a single parent?."
law,"Questions about Deposit before renting property.I'm looking into renting a property in Edinburgh, and the agency is insisting on paying the deposit in full before any contract is signed by either party.

To me this seems like something which I'm not completely comfortable with, but I'm wanting to know if this is just how things are in Edinburgh, or if there is any legal issues with paying before a contract is signed were something to go wrong with the renting."
law,"International diplomatic rights (hypothetical).So this is a purely hypothetical question. 

What happens if one countries leader assaults another?

Hypothetical example: Trump slaps the queen of England."
law,"Under what circumstances would you be willing to sit down at a table and engage in dialogue with BlackLivesMatter activists?.I'm most interested in the viewpoints of actively employed LEOs. So, my request is please would only people in that category respond to the direct question. Thank you very much."
law,"Why are there not more harsh penalties for officers that threaten to arrest, etc for filming?.I've seen so many videos where a person is told to stop filming with their phone on regular traffic stops, and then that they will be taken out of their car if they don't stop. How come these cops aren't reprimanded for that behavior? Seems like something we should encourage. "
law,"Is it fraud if it isn’t you?.Say you have a dash camera and a rear camera, combined with a speed tracker (like from GEICO), then you stopped getting out of the way of bad drivers. 

If you just let people hit you, while having physical proof it wasn’t your fault, how long before you stop getting insurance (theirs) payouts?

Can you be blacklisted?

[USA]"
law,"Comparing the Severity of Two Crimes. Hello, My friend and I were arguing about the severity of two crimes. Here are two hypothetical situations where one individual murders a homeless person, and another individual assassinates the President of the United States. Although both of these crimes are very serious, is assassinating the President of the United States considered a more severe crime since the president represents a role and a symbol?"
law,WA state squatters rights..What are Washington states squatter rights when a lease isn’t in play? If taken to court will they for sure be evicted/removed?
law,What are the main differences between a CR 7.8 and Personal Restraint Petition in Washington State?.
law,"NASA Internet Access.hi, which country does the international space ship's internet is set as? like in China the internet is Chinese which therefore allows websites/etc to detect that the user is in china. what would the ISS be listed as???"
law,"Chapter 7 bankruptcy California.My business partner filed for chapter 7 without notifying me. 

What legal recourse do I have?

Fraud?

He was denied discharge by the way."
law,"In California, is a landlord required to provide housing for renters if the house he is renting needs major construction?."
law,"If my Ex went missing would the police come to question me?.First off it’s not where you think this is going, I didn’t kill my ex. He’s planning to run away from FL and I just wanted to know if I (15) would be questioned about his disappearance. I’m not as worried about what the cops would do as much as my family would do if a cop  knocked on our door asking to see me for questioning"
law,"If someone was lost at sea and presumed dead, life insurance was paid out and then they were found alive [say, 5 years later], would the life insurance have to be paid back?."
law,"I had a scammer send me a fake check and they want me to send a money order to some people, What should I do?.These people wasted a lot of my time and I would like to make sure that they don't scam more people. They don't know that I know yet and they are waiting for me to deposit the check.  They already sent me the information about who the money order is going to. 

How should I proceed and who should I get in contact with to try and get these people?"
law,"Why doesn't the TSA do or say anything when I bring small amoints of marijuana on domestic flights?.Don't they have the authority to enforce certain federal laws, or at least call the police in places where marijuana is illegal? I am concerned about this legal grey area, where people like me can vape marijuana in an airplane lavatory with little to no objection from crewmembers."
law,Trump Testifying.Recently Trump testified for nearly seven hours in his civil case against Michael Cohen. How would you feel about this as a defense attorney or prosecutor. It seems like a really bad idea for him to do so but are there any benefits to this?
law,How do you set up a meeting with an FBI Agent?.I am writer and I would like to accurately depict the process of how a citizen contacts and sets up a meeting with an FBI Agent.
law,"Damaged Money.Location: Kansas

Asking for a friend - her abusive boyfriend in a fit of rage went through her purse and ripped up all her cash. There was about $200 total and all the bills have been torn in half.

Is there any way to get the destroyed money replaced? Are the police likely to help? If not, how should she dispose of it?"
law,"Does Client-Lawyer confidentialty/privilege eventually expire?.Is there a certain time after which a lawyer would be at liberty to disclose the details of any given case? Does that take place upon the client's death, or is a lawyer still bound to not disclose the information discussed?

I'm not from the US and not familiar with US-Law beyond a few summaries and half-remembered legal eagle videos, so apologie if the question's whole premise is flawed. :)"
law,"Landlord stealing electricity and mishandling security deposit funds.Im in the USA, Michigan specifically. My lease says I shouldn't be paying for any common area electricity, but I've discovered a common area hallway whose lights connect through my units power. Additionally my landlord is not keeping my security deposit in escrow, no surety bond either. 

Do I contact a landline rd tenant attorney? County prosecutor? What can I even do here legally? Would a lawyer take this on contingency?"
law,"mn family law question.why is the father first listed as unknown but later on the same page listed by name? and how, after being named as alleged father, is the person not listed as a party in the matter but rather a participant? and is it legal in state of MN to require a dna test to establish parentage when there has already been an ROP signed and notorized?  "
law,"Does a 17 year old moving back to the U.S. have to go to school?.Trying to figure out for work reasons. Recently hired a minor, he was born in the U.S. but has spent his whole life until now in Mexico. Never enrolled in U.S. public schools. Does he have to go to school now? Does a school have to provide a sheet acknowledging a minor working? In Ohio."
law,is it legal to transfer a high school student for being sick with the doctors notes to prove they were sick.One of my friends are getting transferred for being absent she gets sick a lot but get the doctors notes they are transferring her is it legal
law,What makes you pissed at your clients?.Obviously they need to be honest and on time. But are there other majors?
law,(US) Simple way to make living will for non real estate assets to leave them to someone who lives in another country? (cash and investment accounts).I don't own real estate but have savings. I would like to leave them to a family member that lives in another country should I die. What is an easy and reliable way to do this?
law,I want to give my car a viking funeral. Is there a way I can legally set my car on fire?.An accident totaled my beloved car. I could probably get ~$310 from it by selling it to a junkyard but I'd pay probably $100 amount to engulf it in flames. Can I ask the fire department?
law,"Can someone confess without being acquitted?.If someone were to commit a crime without being acquitted, say petty theft, is there any rule saying they can’t acquitted because a certain amount of time has passed making that crime obsolete?"
law,I got summons for a civil law suit.Can i just call the plaintiff lawyer to just settle  and set up payment or do I have to go to court? I have no chance of winning and have no problem paying the amount in the letter.
law,"[Illinois] Looking to buy my parents' home..I have it set on my mind to buy my parents' home sometime in the near future. Its valued at ~405k, and I'm wondering if it'll be legal for me to instead of getting a mortgage, to avoid crazy interest, give my parents a down payment, and pay the rest off with monthly payments, and finally, when it's all paid for, they can transfer over the title. Is this legal? How would they be reporting the additional income, what do I need to know to avoid problems?"
law,what are some ig pages like bar and bench?.
law,"Breaking a Lease in SC.Husband and I want to move. If our current lease says we have to pay a fee of $1,300 to leave before the lease is up, is this all we are liable for? We would be leaving about two months before the lease is over."
law,"Is it legal to ""trick"" people into work by disguising it as a game?.Just the way I've worded it, I expect the answer is 'no'. But could a company create a interface that accomplished some salable activity (I'm thinking along the lines of piloting delivery drones) disguised as a game? Like the player is completing a quest in the game interface while actually doing something like delivering a package for which the company collects payment. copyright yo, plznthx"
law,"Want to own a sword.I (16) live with my parents and want to know if I can own a sword (or my parents) in Florida.

Also my cousin (18) is also trying to figure it out in New York."
law,can a permission be upgraded to an easement?.(England) If I had permission to walk over my tenant's garden to access my own garden. Which perhaps failed the necessity and common intention requirement for an implied easement. Could s62 LPA upgrade the license to an easement if there was a later conveyance for the freehold of that land to the same tenant.
law,"Invitation to witness an execution?.Has anyone ever accepted an invitation to witness an execution? If so, what was the atmosphere like while it was happening? Grim and depressing? Were the victims' families happy afterwards? Did you get to say something to the condemned before (s)he was executed?"
law,"How loud can I play music from my car? Would this change if it is a holiday, like Halloween night?."
law,"NDA and Whistleblower.Is a ""Confidentiality and Non-Disclosure Agreement"" enough to stop an employee and/or former employee from submitting a whistleblower claim to the IRS?"
law,"[USA] If the Christian God revealed himself, how much could he sue humans for?.Between royalties for using his creations in movies and art, and patent violations for making artificial arms and such, and possible defamation charges for when documentaries portray nature as vicious and evil.

&#x200B;

And then there's all those times we made a covenant with him only to break it."
law,"What is prejudicial evidence?.What is prejudicial evidence vs not?

Also, when does evidence become ""cumulative""?

Both questions are in relation to the federal courts."
law,"Questions about legal actions.No signed contract

So me and my friend plus his 2 friends that I dont really know started a small clothing line business but I decided to quit since I need to focus on my own as I cant handle 2 works at the same time. 

I asked for the returns only just what i lend and I did not asked for the profit as a respect.

But he said I need to pay for the offline expenses, the damages too?

from the 8000 that i lend what I did got is 4000 is it right?"
law,What can be done about a landlord refusing pest control on apartments?.My friend is living in government assistance housing (section 8) and has a spider problem. She's afraid her two children under 2 will get bit. She says she's never seen pest control and her complaints to have someone come out are going unanswered. This is happening in South Carolina for reference.
