field,question
law,Tax question.Robinhood reported that I earned $83000 dollars in 2021. I actually lost 4K. Now the IRS is is saying I owe 23k I’m taxes from 2021 and I have until 4/18 to pay. I have the 1099 saying I lost money. What should I do?
law,"I've read several times that people get released from long time prison sentences for wrongful conviction. Are there more of those cases, and what triggers those cases to be reopened?."
law,Did the yellow shirt guy commit battery or is this self defense?.
law,"Let’s just say a private medical institute discovers a way to treat cancer, are they legally allowed to choose not to share this vital research with the rest of the world?."
law,"South Carolina murder trial.I am looking for the discovery documents for a murder trial that happened in 1995. Is the website included the correct place for me to obtain those documents? 

It's called The U.S. National Archives and Public Administration. Y'all please remember I don't know squat about this so plz explain like I'm a 5 year old OK? TY (:"
law,"If I was to protest against chick fil a, what are my rights?.Can I be on their property? Do I need a permit? I live in the United States by the way. Thanks for the help in advance!"
law,"Car Crash in courtesy car what do I do.I have received a courtesy car from my old insurance provider after a minor incident which I am repairing my vehicle through. I have since changed providers. Now I have a completely different provider. I received a courtesy car while mine is being fixed. 3 days before I get mine back I have crashed into the back of someone else and written it off. 

What is going to happen from now??"
law,"Is this legal? I am not a lawyer. I am in the UK. The item in the picture no longer belongs to me….…and I suppose it never did, in a way."
law,"Would Al Capone have been fine if he paid taxes? Or caught sooner? What about nowadays?.Surely if a drug dealer or someone else paid taxes nowadays all it would do is send a bunch of red flags, right? lol"
law,"Are University of Iowa or University of Wisconsin in the National Law Journal's Go-To Law School Rankings?.I'm not in law school yet (because I'm trying to choose a law school), so I'd rather not pay for a LexisNexis or Bloomberg Law account to look at the rankings.

Can anyone tell me if either school is ranked, and, if so, the number it received?

Thank you"
law,At what stage in pregnancy does it become a double homicide if the mother is married?.
law,"Asking a purely hypothetical question..My boss, my friend, and I were talking about statute of limitation and got side tracked. He made the statement that of my friend and I broke into his house and my friend was shot and killed that I could be charged with murder. That just didn't sound right to me. We live in Washington state. Thank you and again, purely hypothetical."
law,"How do I find lawyers who are angel investors?.So, we are about to launch a product that caters to estate lawyers, divorce lawyers and direct to public. However, we need to ramp up our next phase which will require an angel investor either in the United States or Canada. Since this appeals to primarily estate lawyers, we feel that they would see our true value quickly.Advice?"
law,"New job in a law firm- super confused.Hi guys, 
Just started a job at a small law firm that specializes in civil litigation. There is little or no training I’ve just been given assignments on actual cases. I’m stuck and confused I’ve asked the other attorney questions but it seems he’s too busy to issue a response so i’m trying to draft legal documents while also asking the support staff questions. 
Any advise, it’s getting to a point where I think law isn’t for me 😭"
law,"Does anybody know if it is legal to own a replica m18 smoke grenade..I am a young collector of war goodies like helmets and nvg, but I would like to have a couple of Fake smoke grenades. But google doesn’t have any answers for fake ones only real ones…"
law,Is it illegal to download free games? ( Not as simple a question as you may think. ).So I was thinking about Downloading a PC game on to my PS4 (Friday night funkin if you are curious ) is it illegal to do this?
law,"how would you advise your friends, family, and everyone else to not have any legal problems in our whole life?.guessing not having any legal problems happens to many already"
law,What is standard procedure in personal injury law for submitting a demand to the insurance company? Would the attorney first discuss it with their client to make sure they understand and hopefully agree with the amount?.
law,"Atty-client privilege…..What voids Atty/client privilege exactly? Is there any documentation which can be shared with courts that would not expose a client to losing atty client privilege ?
Can a client say they do not wish to waive Atty client privilege but accidentally pierce it and lose it? If so, what types of things would pierce privilege?"
law,Lawyer problems.What are major problems lawyer faces most often?
law,"Is not giving your child a therapist illegal?.I’m not sure where to put this so I thought I’d put it here

Backstory: I have a friend who’s under 18 and is going through problems with their mother, and despite confessing to their mom that they’re contemplating suicide they’ve never gone to a therapist despite asking, is this illegal?"
law,Will I get sued by Nintendo for copyright?.So I’m trying to open my own EDM nightclub and I want to name it Rainbow Road. Would I get sued by Nintendo for using the name even though it’s a nightclub and not a video game?
law,"In the Murdaugh murder trial, the defendant’s lawyer pointed a gun ( the supposed murder weapon) at the prosecutor and said “tempting.” What are the consequences for doing something like this?.Have there been consequences for this lawyer? It seems bizarre that this didn’t stop the trial with the defense attorney’s arrest.

Editing to add link to NY Post coverage of the incident: https://nypost.com/2023/02/21/alex-murdaughs-lawyer-dick-harpootlian-points-rifle-at-prosecution/amp/"
law,"How does it work when new land is created inside of private property do the original owners get more land, is their land now fragmented and the state owns the new land?."
law,"Do mounted units (cops on horses) get paid more than other cops (car, bike).Today I was thinking that the mounted units make sense to get paid more since they have to kearn an extra skill. I’ve seen the mounted coos also drive cars on patrol. My question is that do they get paid more, like a small bump in pay?

For example lets say in Los Angeles or New York. If not; can you explain why not?"
law,Can a member of the victims family prosecute the aggressor.
law,Looking for a rec for employment lawyer in Delaware. We’re in NJ so don’t have any connections..
law,"Which countries do not share driving records?.Can someone with a car registered in, let's say, Andorra get a driving fine in Belgium for example and not have to pay the ticket because the information about the driver is not shared by those 2 countries?

  
Could someone with a car registered in the USA with USA plates be in a similar situation when fined in Europe (by for example a speeding camera)?"
law,"Defamation of character? Legal advice pls..long story short, a jealous/psycho ex girlfriend has gone to the police after over a month of no contact accusing me of stalking her and has made up a load of false allegations against me. She hasn’t made a statement and has no evidence. The police have taken my phone and so will see the truth, I know I’m innocent but can I get her prosecuted for lying? Defamation of character?"
law,"Auto Insurance Scam Possibly?.Last night I received 2 emails and 1 text with auto insurance quotes for a 2019 Volkswagen(which I drive). The issue is, I did not request these quotes and they are all addressed to someone with a different name than me. Is this just a sort of mistake or some sort of fraud? And, if so what should my next steps be?"
law,"ENG small claims - how to make payment to other party after judgment ?.A) How should you make payment to the other party after judgement ? 

Eg to the court or to the other party direct ? 

B) And How should you advise the court that the payment has been made (baring in mind the other party may not respond to receipt of the money) 

C) is there a court form to fill out and file ?"
law,"Baker McKenzie advice?.Just looking for some insight into the work culture, type of people, career progression etc? Ideally from those currently in or who have previously worked there. Banking & finance team ideally. Thanks!"
law,Hey! I'm taking my high school seniors to the Supreme Court on Monday to observe some cases and I am straight-up baffled by the briefs sent to me about the cases. Will one of you fine lawyers provide an ELI5? (Briefs in description).[Briefs](https://drive.google.com/file/d/1rjRPTmeLiFRV7QWmXy16J7PWrmhFsbTl/view?usp=sharing)
law,Will we need to find a HMO licensed property?.I’m looking to move to a new rental property in the summer with my long term girlfriend and a mutual friend. We are looking for a 2 bedroom property but will we need one with a HMO license since there will be three of us? Or does my girlfriend and I count as one household and our friend another and are therefore exempt? Any help is much appreciated. We’re based in Scotland fyi
law,"can I get in legal trouble for using BIN generators to sign up on free trials in some apps?.I live in Egypt but I sometimes use bin generators to sign up and get free trials on some websites based in the US, can I get in legal issues for doing this?"
law,"Giving the police my name and date of birth..Two cops knocked on my door asking if the landlord is here which was weird, I said I’m nothing but a tenant so they said they’re looking for him because he’s on bail, and then they asked for my details so I provided them with it, should I be worried?"
law,Received two water bottles at my hotel from house keeping one was filled with rubbing alcohol.As the title says my girlfriend and I received two water bottles one was cracked my girlfriend took a sip out of it thinking I cracked it but spit it out when it burned her mouth. We've complained to management but is this a legal issue we should pursue? Her upper lip has a little discoloring now as well.
law,Does anyone know an estate planning attorney in North Texas?.Can anyone recommend one in the Dallas area?
law,"Can I legally drive in the US with just a photo on my phone of my driver's license, and not have to carry the physical card on me?.The idea is to leave my wallet at home and use my phone for purchases."
law,"Why do courts that decide to try a minor as an adult, sentence that person as a minor?.In trials where the court decides to try a minor as an adult, you often see sentences altered from what an adult would receive because the convicted person is a minor. Wouldn’t trying someone as an adult demand that they be sentenced as an adult? Isn’t that the whole point?"
law,"Roommate recording me in our room.Roommate recording me in our room and didn’t tell me I found a camera in our bedroom were I change in everything, is that legal?"
law,"Lawyers: what is a law focus that guarantees someone will be kinda weird?.**i feel lawyers are depicted as passionate/intense/exciting in media, but IRL are often some of the most boring people you'll ever meet. what kind of law practice basically guarantees someone is interesting? Maritime? IP? where are the weirdos/creatives practicing?**"
law,"Can NY compel Trump to appear in state court, or does it need FL's cooperation to compel him to appear? If he failed to appear, would NY need FL cooperation to enforce a judgment against him, assuming he never goes to NY again?.Edit: DeSantis will not assist in an extradition request: https://twitter.com/GovRonDeSantis/status/1641575007552778243?ref_src=twsrc%5Egoogle%7Ctwcamp%5Eserp%7Ctwgr%5Etweet"
law,"[Los Angeles, CA] [USA] Can I allow BYOB alcohol without liquor license?.At a cafe, can I allow the patrons to drink inside if they bring their own bottle? Or would I still need a license. Better yet, can I get a temporary permit one for an event? If temp one where do I go to get one?"
law,Co workers wife hit me head on..Was just involved in a head on collision w my co workers wife. He wants me to put that he was driving not her. I’ve started talking w a lawyer but haven’t been able to sit w them yet.
law,"What’s the difference between the 5th and 6th amendment?.I know this is a dumb question. However, I’m studying for the AP gov exam and I really need to know the difference. 

It seems to me like the 6th amendment is redundant in regards to the 5th amendment, and I know this interpretation is wrong, so I am trying to understand."
law,[US] What criteria does an organization have to meet in order to be categorized as a criminal organization?.What criteria does a criminal organization have to meet in order to be categorized as such?
law,"Ex is trying to blackmail my wife..Long story short, my wife broke my son's (her stepson) phone on purpose. We paid for a new one, no questions asked. Its been two weeks and the ex is now threatening to press charges (she already talked to the police and decided not to the day of the incedent) if we dont give into what she wants about something.


Can she press charges weeks later when she already told the police she didnt want to?"
law,"Filing Small Claims Court Case.So I had someone do construction on my property, they did an awful job and broke thousands in property. I submitted a court case with them and have been unable to server papers  


I called the person who opened permits to do construction on my property, who is different from who actually did. They said the person who did the construction left to Mexico.   


**Can I switch the claim to the name of who opened the permits and hold them liable?**"
law,"Being Drug tested at work/ smoking in another country.So my work can do random drug testing, although everyone i have talked to hasn't had one yet and has been there years. but i was just wondering for example if i go to a country where weed is legal and smoke there, then come back and get tested can they get rid of me/ is that illegal ?"
law,Do waivers really not hold up in court?.I hear people say all the time that waivers don’t hold up in court. Just wondering if this is a myth or actually true.
law,What happens if NYS doesn’t pay out a settlement by their deadline?.Settlement amount was approved but have been waiting longer than the deadline for it to clear.
law,"A Way to Look Up Outstanding Warrants (United States).I'm trying to look up info (arrests, outstanding warrants...) for a guy I used to know. I know he was arrested when he lived in Michigan, but I cant remember if the arrest took place in Ohio or Michigan. He has a very vanilla name, so a Google search isn't getting me anywhere. Is there a public records database online that could help me sift through all the noise?"
law,"Corporations, ships, partnerships, counties, states, all have at one time or another been granted personhood..I think the thing that makes these non-human entities a person is that they are a party to legal relations. Where do we stand on extending personhood to extraordinarily cognitively complex, self-conscious, and self-determining non-human individuals?"
law,Is the Congressional Part of Impeachment similar to a Grand Jury in a Criminal Proceeding?.Pretty much the title. I'm not American and I am just trying to understand the Impeachment process better. It seems based on what I have read that the House portion of Impeachment is similar to a Grand Jury in the sense that it decides whether the matter proceeds to trial or not.
law,"Would this avoid the exit tax?.Of course, they'd talk to a tax attorney. For the sake of curiosity would this scenario work.

Person A transfers all assets to person B. A and B are US citizens. B moves to a foreign jurisdiction and gains citizenship, and renounces US citizenship. A then transfers assets back to B."
law,"HOA was never disclosed upon purchase of home.We purchased our home more than 2 years ago which there was never any mention of an HOA. Fast forward to now some people have come out of the woodworks and revived what apparently was a dead homeowners association, made a website this year, and started requesting money from the residents for this year and for the past year. Am I legally obligated to pay these HOA fees?"
law,"Are presidential pardons published somewhere?.I was trying to find the explicit text where Jimmy Carter pardoned draft evaders. It seems that the Federal Register, which appears to be the closest to a government gazette, doesn't include any pardons. Is there any obligation to publish them at all?"
law,"I broke my finger from an accident outside work.I’m unable to work at my zero hour factory job because I broke my finger and my job requires both hands for efficient working. I told my boss and said I could work with one hand and he said that I should let him know when I can work again. I’m a student, can I claim anything from not being able to work? Thank you 

(England)"
law,"I've always heard that African Americans and other certain marginalized groups face harsher sentences than white people who commit the same crime, but what about groups like Asians?.What I am trying to say is, do Asians face harsher sentences than whites for the same crime, or vice versa? Is there even a study on this? Would this technically make white people more marginalized than Asians with regards to this?"
law,"Contractor suing me for his unfinished job.I paid a contractor on a friday to return to finish the job on Monday, he didn't show up until tuesday, I had already stopped payment  on a portion of what I paid. Now he is suing me for that even though he didn't finish the job. Can I counter sue him for the cost to fix the damage he did and to finish the job he didn't finish."
law,"Company that was garnishing paychecks said my balance was $0, let the account sit for a few years (apparently still owed some change) to gain interest and is now taking my money again..I live in the state of Tennessee. The company showed the balance owed as $0. Then one random day my bank froze my accounts saying I still owed interest from the lawsuit. How can they charge me interest on a $0 balance? They just took all of the money in my account. Is there anything I can do?"
law,"Cowboy roofer demanding money for poor work.Hi all,

Had a cold call from cowboy roofer and we stupidly allowed him to do some work… After noticing the roofing work is unacceptable he is demanding his money for the work and trying to pressure for it. What would be the best situation as he says he’ll return to collect his money later on 

Police has been contacted and they said just to not engage with them and return anything they’ve left behind outside our house."
law,"[US][AL] Contempt of court in My Cousin Vinny.So I’m going to law school next year and decided to re-watch My Cousin Vinny (great movie) and noticed that he was sent to jail for contempt of court, and then returned to the stand. My question is if a lawyer were to be put in jail, would they have their license examined by the ABA, and possibly suspended until a decision is made? Or can they just return to the stand the next day like Pesci did?"
law,"I need police help for my writing....I'm trying to do some writing, and i have this family that was followed half way home by someone that's been after their kid, this kid is a foster kid, how would you go about protecting the young girl that has two older siblings? would you post officers out side of their home? I don't know how this works, any tips would be helpful. thx!"
law,"Getting Easement for Landlocked Property.1) Can the property owner (whose property is blocking my access) legally refuse?  
2) Are payments in exchange for easement usually a one time cost or on-going like rent?  
3) If the ""blocking"" property owner refuses, is there a way to use the legal system to fight them to grant me one?  
4) Are there cases where property owners actually use this to their advantage? (i.e. lock land to ""force"" future potential buyers to pay up)"
law,How do I request an adjournment?.Going to court on the 27th for an eviction hearing. I would like to avoid the extra headache on all parties involved  and request an adjournment as even an extra week will allow me to pay the backrent owed (the complex has stated the case will be dismissed if the amount is paid.) I am a little underprepared at this moment and would like to know how to request an adjournment? Or if it's possible to?
law,"Selling subcriptions for services.Hi, I was wondering if it was legal to charge non-family member for a subscription with the family slots for services like spotify, apple music, etc"
law,"Done sue me.Is it illegal to make profit over Simpsons style caricatures?

I started doing a few of friends and family for free and i have had a few people ask about having one designed for them. But i really don't want to get sued!
They are unique to each person and do not resemble or feature any recognised simpsons characters but they obviously are yellow in colour and hold Simpson like characteristics.

Thanks in advance 🤞"
law,"Can DNA change a will?.I am 53yrs old, just completed DNA testing & located my biological father. He has dementia & his will is already written. (I now have 3 half siblings). Dad doesn't believe I'm his daughter. Since I am new on the scene, I don't want to have this conversation with half siblings but where do I stand? (New York)"
law,"No Contact with a friend.In late January, me and my friend were attacked by people. Somewhere through the fight my friend was stabbed. For some reason, the court was trying to say that I was the one who did it and placed a no-contact order on me to not be able to see him. Both of us want it lifted, but don’t know how or if we’re even allowed. Is it possible? This was in Canada."
law,"Self- plagiarism.If an author took their own published work of fiction, changed the names of every character and re-sold the rights as an original work and then the original publisher wanted to sue for plagiarism, how would that turn out? Plznthx"
law,Is it illegal if you are ‘caught’ transporting an ‘opened’ pharmaceutical bottle of prescription pills that are not your’s? Could you be arrested for this even if you have a legitimate reason for doing so?.
law,"The Tiger King just announced his 2024 run for the presidency. Hypothetically, let’s say he wins, against all odds. Would he legally be allowed to use the “presidential pardon” power on himself to get out of prison?."
law,"What is the difference between Insurance Defense practices and Litigation Practices that actually defend Physicians in High-Stakes Medical Mal cases, including those that reach trials?.When researching firms, how does one differentiate?"
law,"Is there anything I can do?.So I lent an ex 2400 and she refuses to pay back. I haven't received anything. I sent the money on zelle and that's my only receipt I have. I no longer have texts that she agreed to pay. Now I really need the money and was wondering if there's anything I can do.

She also still won't send any of my belongings

Note: she's in nebraska and I'm in las vegas."
law,"Can a law change another law into something unconstitutional?.So, Texas is going to argue before SCOTUS that when the tax reform law removed the individual mandate tax from Obamacare, the Obamacare law became unconstitutional.  To me, isn’t the tax reform law the problem?  Shouldn’t SCOTUS kick this back to congress and tell them they can’t just go around passing new laws to tweak old ones making the old one’s unconstitutional?"
law,Would California law against recording private conversations without consent of both parties apply to a voice-to-text transcription app?.
law,"Husband has left, can I change the locks?.hi, TA for privacy. Husband of 10 years up and left out of the blue Monday night. We have 2 children, 6yrs and 6mths). He has officially left the family home, staying with his mum. Legally, am I ok to change the locks if his name is on the deed? (England)"
law,What college courses are best to aid me in my journey to become a lawyer?.
law,Why do the rear-ends of Police Chevy Tahoe sit so low?.
law,"Visa question..How do you enter a country Visa free? As in US to Canada, when you arrive at the border or flying? I have always been told and see on the internet that we get 180 days ""visa free"" in Canada but every time I fly I seem to end up with a B1/B2 visa, is there something I need to say or do anything? Sorces are highly appreciated!!! 
Thanks in advance."
law,"would it be legal for a law making adultery illegal?.Now what constitutes cheating precisely in a relationship is up to debate, and I foresee some issues with enforceability if defined too broadly, but how much could actually pass muster?

Like could it be squeezed in as a form of fraud?"
law,"Is it illegal as a divorced mom to talk about the dad, or vise versa, in a bad way to your child after the divorce? (this is assuming the child is under 18)."
law,My family and I rented a trailer for 2 years. Decided to purchase through the trailer company and bank they use. Signed an agreement that they’d fix things even after we purchased. Now they’re dragging their feet to fix things. Are they liable for repairs if things spread?.Mainly I’m referring to leaky window in the bathroom and the floor weakening at the tub (due to some leak I assume). I live in Oklahoma for specifics. I can give additional details if needed.
