field,question
law,"Which declares the owner of a house, the will or the deed if two different people..I live in New Mexico, some time ago my grandma passed away from cancer and left his house he built to his girlfriend in his will, but he signed the deed over to his brother before he passed. Who would the house legally belong to?      Also to add, he was on heavy pain killers at the time of his passing when he signed the documents if that makes any difference."
law,"What's next for Executive Order 13769?.Can you clarify what happens next? Does the actual order get taken up in district court somehow, as I've read, and then go back through the 9th? Or can it go right to SCOTUS?"
law,not sure what kind of lawyer I'm looking for. I bought a boat and discovered after 2 years it still has a lien on it. and I was never made aware of said lien. trying to get title for the boat and cannot cause of lien. is there such thing as a title and lien lawyer?.
law,"signing bonus clawback.I’m contractually supposed to pay back my signing bonus. I was employed at a $500 billion dollar asset manager. It’s roughly 5 grand. 

Will they come after me for it? Should I pay it? I’m moving across the country."
law,"Are there any fields of law that have ""reasonable"" workloads?.""Reasonable"" relative to other jobs (e.g., 40-50 hours/week would be ""reasonable""). Do any of the larger law firms balance workloads to something like this?

In private practice, would limiting yourself to something like this be unprofitable?"
law,Deferred prosecution.I got charged with possession of marijuana when I was 18. I did the deferred prosecution/pled guilty did my community service and all that good stuff. Just wondering if this is/will be on my permanent record and if it’s worth trying to get this expunged so future employers do not see it. Any advice?
law,If my ex boss had me working illegal hours then fires me should I sue.I (under-16) was working as a pot wash at my local pub and recently got fired because the establishment was looking for a more efficient and permanent employee. At the time I was working at least 10 hours a week as I had closing shifts so my finishing time was never really consistent both of my shifts were on school nights and my GCSE’s are coming up and I’m not too sure on what to do about my now old job and employers.
law,How high exactly is the burden of proof to get permission to raid an attorneys office?.
law,(America) can you get hired to do porn before you're 18 as long as you don't perform the actual scenes until you're 18?.The reason I'm asking is cuz someone told me a story about their friend where they performed in pornograpy the day they turned 18 so can you like interview and get hired while you're still a minor as long as you don't perform until you turn 18?
law,"Can I report an stolen item to the police while being an immigrant(an illegal immigrant).Someone stole my bike today, I know the time interval that it was stolen, and I know the area they might be in, I was looking for it myself when one of my neighbors told me I could report it to the police. The problem is, I don't know if Its a good idea since I'm a illegal immigrant, I fear they might just send me back to my country."
law,"There are rumors reported in the media that the Manhattan D.A. will indict Trump soon. Georgia and the DOJ are also investigating Trump. If Trump is convicted in two different court systems, where will he have to serve his time first?.Is there a set protocol, like the first state or DOJ to convict keeping control of the prisoner?"
law,"Air Quality Conditions.Does anyone know child labor laws or labor laws in general, that are related with the air quality when working outside? Today we reached an unhealthy air quality and my manager says he will make the call when to cancel outside work crews. I work in Colorado if that helps."
law,"[US] Lawyers of Reddit, what are some interesting summer positions you held in law school?.I'm talking about stuff that's off the beaten path - not clerkships, BigLaw summer associateships, or working for a small firm/solo. Are there any unique work experiences you undertook during your law school summers you would be open to sharing? Thanks in advance!

Edit: To be clear, I'm not looking for ideas for my own summer opportunity or anything, I'm well past that point."
law,"Have you ever stopped someone for break checking? What did they say?.I Just don't understand the trend of people break checking others on the highway. Is there even a point to it beyond being a dysfunctional asshole? What do those people say when you pull them over? If I had to guess, I'd say they probably just make up some bullshit about how they didn't know what they were doing and they were just breaking because (insert excuse here). I'd be curious to hear about your interactions."
law,On deed not mortgage what does that mean?.I’m on the deed of our house but I am not on the mortgage loan. If the house was foreclosed on what does that mean for me? Anything? TIA!
law,"Which are some of the successful policies / laws, which might fail in other countries?."
law,Can I be prosecuted for begging?.I’m in England. Is it illegal to ask strangers for money on the street? Am I likely to be prosecuted or is it a warning type of deal?
law,"Small Claims, No Contact.What am i supposed to do or what does it mean in a small claims case if the officer says there was no contact when serving?"
law,Foreign Jurisdiction Question. When investigating a threatening email that originated from outside the United Stated. What problems and jurisdiction issues will occur for a computer forensics professional who wants to investigate the sender of the threatening email who is from a different country? How does one gain legal jurisdiction to further investigate this issue if the laws in the U.S. does not apply to the individual from a different country?
law,"What sentence would someone get, if they murdered both of their parents, while being both drunk and drugged, and also having history with depression and anxiety? [This is for a book I'm writing and I want to write it with the most probable sentencing someone could receive]."
law,"How much does it cost to evict a family member in Mississippi?.I want to know how much it is minus Attorney fees. Namely court costs, filing fees, etc."
law,Are novelty parking signs (i.e. Cowboys fan parking only) legally enforceable?.
law,"[US/Colorado] Traffic Question.Last night my wife was turning left on Green when another car hit her back right wheel.

The police gave her a ticket for careless driving.

She has made this turn twice a day for over 4 years without incident. I don't think this is her fault.

How bad is this ticket?

Is it worth it to fight it in court?

Is it worth it to get a lawyer?"
law,"UK can a bank lock you in a branch.I was in my branch today and as I was about to leave a member of staff locked the doors because they were moving cash within the branch.  I objected and they hurried themselves up but stopped me leaving until they completed the move.
Is it legal for them to do that?"
law,Is it legal to buy the DAVID delight (product) online and ship to Australia/use or possess it? Do I need a prescription?.
law,"Ripped off by attorney, does fee arbitration actually work?.I tried to negotiate but it’s not working. Debating whether to escalate it with the state board"
law,"Could the government step in to prevent a large enough nursing strike?.Recently we had a huge nursing strike in MN, one that involved pretty much every major hospital in half the state. The hospitals were able to bring in enough temporary nurses to keep the hospitals functioning. Hypothetically, if these travelers didn’t exist or were unwilling to come help would the government allow nurses to flat out shut down hospitals? Or would they step in and remove their strike protections first?"
law,"NJ-How does DCF work.We know someone - a child - who notified a school counselor that a parent was being abusive (physical violence). School notified NJ DCF, who conducted in-school interviews. We understand that the state is taking some action in regards to this but don’t know what is happening. I’m curious what can happen after the state gets involved from here, and what roles community members and acquaintances can permissibly play supporting the children through a horrific time."
law,"Question for cops/police officers specifically!.This is a throw away account! But I was wondering would cops actually investigate “ heavily” in a serial pedophiles killings. (Down south.) 

(This is a humorous question.)"
law,"[URGENT] Do babies have human rights?.Its for a debate,"
law,Avg length of a civil suit / would you step away?.What’s the avg length of time for a civil suit you’ve been engaged in? Have you ever considered withdrawing because your case load is building and a case you thought would have ended is lingering on? Can you ‘step away’ if you have too many cases ongoing and you’re worn too thin? How do you choose the case(s) you cut?
law,"(US) If someone was sentenced to be executed, but then spontaneously returned to life, would they be free?."
law,"If you kidnap someone who committed a felony against you, can you plead self defense?."
law,Is there ever any smoke here. Are all the foreigners just not that interesting to patrol officers.
law,"Is legal standing constitutionally required, proscribed, or somewhere in between? Should standing be expanded or limited?.Looking at you, *Biden v. Nebraska*."
law,"In Illinois, what are the laws of custody if a couple gets a divorce right after their baby is due?.How do they go about taking turns who gets to have the baby if they live separately like is there a certain time after the baby is born before they can do overnight visits? My friend isn’t on Reddit so she wanted me to ask for her!"
law,"Legal? Trust Fund Beneficiary's Children to Benefit from Home Sale as Listing Realtors.Is it legal for a family member to act as listing agent for a house listed in a family Trust...
Immediate children are beneficiaries of Trust and a grandchild-in-law is listing agent... 
Thank you in advance for any and all answers, suggestions and advice."
law,can i get in trouble for not responding to a subpoena i never received.My exes mom has told me I'm being subpoenaed thing is they have no idea what my address is nor do I have a way to contact any of the courts and I don't live anywhere near that town can I get introuble if I don't go and don't get served papers
law,Did you have to memorize the constitution and to what extent?.
law,Man goes viral after he returns a bag full of money his local McDonald’s accidentally gave him..Simple question would he legally have to return it?
law,[US] Is it possible to have less strict abortion laws at the city/county level that would override stricter state laws?.I’m wondering if this might be a way for allowing easier access to abortion in cities (since they are typically more progressive-leaning than rural areas).
law,"Can an officer walk into your backyard for a noise complaint?.I had a party, an officer opened my gate walked into my property and went to the backyard to talk about a noise complaint. Is this legal?  He can't just walk into my property when I never gave him consent."
law,"Does anybody know, in all the court cases the government participates in, what percentage of them does the government win? Total, federal, and/or state.."
law,"Double jeopardy Scotland rules.Hi so I have a friend who is in court just now his charge is dangerous driving which cause the pedestrian to be in a vegetative state 

If and when they die can he be charged with death due to dangerous driving 


My understanding of what I read is you can’t be charged for something after the fact if you’ve already been to court due to the incident 

Am I wrong or is there another law that allows this to happen?"
law,"Is it legal for me to date him?.I live in Georgia and me (18) and My friend X (15 turns 16 in may) have mutual love feelings for each other. Now I don't do sex, nudes, or anything of that nature.
Can we date? I don't know if Romeo and Juliet law cover us. His parents seem cool with it (well His brother and his ex were the same age difference)
I just don't want to get attached then find out it's illegal that's all"
law,"Help me understand promissory estoppel.I understand that promissory estoppel means that a promisee may still receive damages in a promise without the element of consideration. But don't all bargains inherently include consideration, as you are exchanging one good for another?"
law,"Is there a gray area with shooting at drones above your property?.Clearly you can't destroy a drone that's just passing by your house hundreds of feet in the air. 

But does it become less clear if the drone is just hovering really close to your house? Or is it still very clear you can't legally shoot the drone down?"
law,"Is it illegal to have a cat in the cat not in its cage.I have a cat in the car and have my cat in my lap with a harness and a leash that I can lock to stop my cat in her tracks. I am in the front and I am not driving. I read that you can have a cat if it is restrained and I am but she isn't in a secure restraint like in a cage. Is this illegal? 

Edit: I'm in England"
law,"Do I have to be a witness?.A previous employer has a court date to fight a ticket received during Covid, in Ontario Canada. I was present when the ticket was issued, but have not worked there for 2 years. They are asking me to appear in court as their witness. I cannot as I now have a full time job. But to my understanding, as long as there is no subpoena I do not have to appear. Is this true?"
law,US (Texas/California): im going to get my California intierm drivers license in May. A month later im going to visit my friends in Texas. I was wondering if i can drive in Texas with a California intierm license..
law,Can Valet Service pickup person go through trash ?.
law,"What would be the legal implications of the trolley problem?.The trolley problem:

 Five people are standing on a railroad track, about to be killed by a train but, you can switch the track to a different path where only one person is standing. Thus saving the five people but, killing the one.

Would you be tried for murder because you actively killed a person? Would the family of that person be able to sue you for causing the death of their loved one? How would a court likely rule?"
law,"Resort gave us a receipt with my son’s name on it although I used my credit card. Am I technically responsible?.I noticed this after the fact, my wife and son are on vacation and the resort charged us a room upgrade fee, but my names nowhere to be seen on the receipt, but it’s my credit card."
law,Is there anything I can do knowing someone is cyber stalking me in Arkansas?.I’m currently terrified of my bf’s ex cyber stalking me and digging up information about me and my family. I have no idea if there’s anything I can do in my state. I’m terrified of this person and have verification from her friends that she is currently stalking me and my bf online and possibly in person. It’s so freaky. Any help is greatly appreciated.
law,Cross state prank calls.I was just wondering if i prank call a pizza hut in idaho (i live in hawaii) can they call the police on me? (It might be a dumb question but i really am curious
law,[Washington State] Can someone else represent me in small claims court?.My old landlord has not given me my deposit back or any notice of any possible damage after 3-4 months of reaching out. I moved to Arizona - can someone else represent me?
law,"In UK law, how significant is a 'right-to-sue' over defamation?.I'm in the USA trying to understand whether a wacky friend in the UK is talking about something serious or they're just making a big deal out of something very basic that is easy to achieve from very little effort.  


The defendant would be the BBC - so I'm guessing they're just grandstanding about this first step and will never follow through with another inch of the process."
law,"I’m a PI attorney and dont know much else and hate my life, what do I do?.I went to law school thinking it would be a good degree, I worked in a hospital before school and loved it and thought about healthcare admin before I knew what an MHA was. I got into PI mainly cause the firm was hiring when I graduated and I like groceries. Now I feel stuck in PI and dont want to justify the debt to go back to school and though a JD is great, hospitals aren’t necessarily looking for it. Any advice?"
law,"I'm 18 but my mother is withholding my inheritance from my grandfather's passing, is this legal?.My grandfather passed away when I was 17, so my inheritance ($5,000), was of course given to my mother to take care of. Now I am 18, a legal adult, and after asking multiple times for my inheritance money she has denied giving it to me. Is this legal? If not, what can I do to get it? If so, will I ever be able to receive it without her permission?"
law,"Would a custom car horn be legal in the US.If someone's horn was designed to play music(like honk in tune to despacito or undertale themes or something) would that be legal?

And if not, why?"
law,"Is religion subjected to strict scrutiny?.In some sources, religion is under suspect class, but my prof said it isn't. I'm confused now."
law,"Can the US congress direct courts in how to interpret statues?.Let’s say, hypothetically, congress passed a law aiming to regulate statutory interpretation. The law’s aim is to over-write the doctrines developed by US courts concerning statutory interpretation with new doctrines of congress’ own making. 

Would this be constitutional? If not, why not?"
law,Guessing breast sizes in a public place.Is it against the law to record and publish someone guessing a woman’s breast size then asking them if it’s correct?
law,"can a high school principal keep giving my little brother more time in alc.see my little brother when at the beginning of the year he did some quite dum stuff and got into ALC for 126 something days and high school principal keeps saying verbally mean stuff to my brother and the high school principal said he's getting permanent alc for not opening the door 

which next year my little brother does not get out when the original suspension is suppose to get out   what can i do PLEASE HELP"
law,"Is this dad likely to get full custody?.[https://www.dailywire.com/news/one-fathers-nightmare-battle-for-3-year-old-son-mom-is-raising-non-binary](https://www.dailywire.com/news/one-fathers-nightmare-battle-for-3-year-old-son-mom-is-raising-non-binary)

Seems like a bad situation."
law,"Got a ticket for “turning across traffic from curb and causing an accident” [PA].In my opinion I wasn’t completely at fault for this but here we are and I have a ticket.

My question is if I’m found guilty of this infraction do I get any points added to my license and how many? I’ve never had any traffic violations before."
law,"Keeping them safe.My wife had an affair and during that she brought our kids around him and he brought his. His wife got a order saying she cant be around his kids, i was wondering how i go about that with my kids and him. Weve been sepreated and she was told she ended things with him but im not sure thats the case now."
law,Federal Constitutional Rights for Poor People.Can someone point me to the SCOTUS case which allowed/permitted the States to charge a fee to exercise ones Federal Constitutional right. Do you think the precedent would be overturned by the current court?
law,"Legal definition - ordnance ordinance.Don't worry, I know which is which. Title is just a pun, my local park has a sign declaring that is an offence to (among other normal things like drinking booze and playing golf) ""throw missiles"". It does not clarify what it means by missile. What would the definition of missile be for a local council rule? Javelin? Javelin™️? Nerf vortex?"
law,"Why can't doctors be prosecuted for murder?.Given the current controversy surrounding Alabama's new abortion ban, and the expected upcoming legal challenges, what stops prosecutors from just charging abortion providers with murder, given the opinion that the new life begins at conception and is a 14th Amendment Citizen deserving in every way of protection as any other person?

Has this kind of prosecution been tried?"
law,"Question about my history of psychosis and legality of my actions..How would my case go if I was in court? 

I sometimes did knew what I did was wrong and still acted in violence, even though I was psychotic at that time for one month, at the age of fifteen."
law,"What is a 'coalition letter'?.I can Google, but everything I find is these exact letters or 'comment letters' which are not helping, because I need to translate the term."
law,"My phone was stolen, what can police do with the IMEI number?.A crackhead pick-pocketed me tonight, and video evidence didn't provide enough for police to do much. I've exhausted all of the possible ways to track down my phone to no avail, and I was wondering if police could find it with the IMEI number. It has ALL of my photos/videos of the last (also first) two years of my son's life and I'm absolutely heartbroken"
law,I want to do a parent taught drivers ed..If I do get stopped by a cop how do I show them that I’m doing my behind the wheel hours. ID or like will I get a paper. The course is online.
law,"Dismissed from work with 1 days notice.so my employer just informed me that as of tomorrow i will be unemployed, no reason other than the fact that the shop i was working/managing wasn’t doing too well sales/end of week takings wise & that they were selling the shop to a new owner & that as of tomorrow i’ll be unemployed, not due to negligence or any other reason, is this legal? if not what sort of route can i take towards them?
for reference i live in the UK, London 

hope someone can help!"
law,"Maybe a stupid question, but can a man who's considered dead be charged with a crime?.Let's just assume the following (and rather ridiculous) scenario: you're presumed dead, and thus get a death certificate. However, you're in fact alive, but no one knows about you. Years go by and you accidentally killed a man. Now, could you be charged with such a crime, if the state thinks you are dead?"
law,"Would you rather have a bench trial or a jury of 12 practicing judges?.Two scenarios for the Jury option:

1) The judges all practice the same area of law relevant to your case.

2) The areas of practice the judges specialize in is random. That is family court, personal injury, criminal, lemon law, etc."
law,"Why are Defense teams always in favor of a venue change and Prosecutors always against it?.Nothing is ever black and white, but in this scenario, I’ve never seen the two parties differ. Why?"
law,Are multi level marketing contracts legally binding?.
law,"A few Questions for Law Enforcement Officers.1.      What considerations are there when developing your crime scene plan?  
2.      What information would you provide when preparing your search warrant?  
3.      What information and recommendations would you provide to a pre-raid briefing?  
4.      What questions would you ask the intelligence briefer about your part in the mission?

&#x200B;

Thanks for your responses they are very much appreciated!!"
law,What would a Head Detectives badge say?.
law,"Made a purchase, company is trying to charge me more..So, I made an online purchase from a company because I saw a product at a good deal. I paid and everything got an order confirmation and an order number. Now I get an email today claiming it was a ""site error"" and they are invoicing me for the difference. Is this something they can really do? Both I and the company are based in Texas (if that helps). It is a business as well not a small business or a single person."
law,"lawsuit against government agency for staff safety.As the title says, what justification would be needed for a winning case against a branch of government?  Due to poor leadership or simple dereliction of duty, lack of staffing has some employees working on average of four 16 hour mandatory shifts per week. IE: if they show up for a standard 8 hour shift, they get mandated for another 8 hours before they can go home. This happens multiple times per week."
law,If I get a class a misdemeanor expunged am I still barred from becoming an officer in Texas?.When I was about 20 I got arrested for possession of marijuana in Kansas. This is a class a misdemeanor in that state. I have not had any legal issues other than a single speeding ticket since (a little over a decade). If I were to get this expunged would I still be barred from receiving my license from Texas commission on law enforcement?
law,"Dr's notes and work from home.I have a question! My friend recently told me that her employer doesn't accept Dr notes for a call out. Is this legal? She works for a phone company and the majority of her work is done from home. Is that why they wouldn't accept it? 

Edit: located in the US and from CA"
law,"Who wants to let me pick their brain?!?!?.hey now! i am a writer and i am currently writing a fiction crime novel.....i would LOVE to talk to a detective and/or a police officer, i have LOTS of questions lol even tho it is fiction i also want it to be realistic....thanks 😁😁"
law,big question.How would a group of people get a class action lawsuit going for false advertisement?
law,"Declaring driving points to insurer.Insurance companies asks for convictions within 5 years.

If its been 4 years since your points and their off your licence do you still have to declare them to the insurer?"
