field,question
law,"[Australia] Can Americans from America and as American as apple pie, own houses in Washington D.C?.I'm asking since in the Australian Capital Territory citizens don't purchase property per se, they can only buy leases to the land that last up to 99 years. Once the leases expire, you've got to purchase the lease again.

Since Canberra and Washington D.C were both planned capitals of interstatual colonial federations, I'm wondering if and how the property laws differ (or if they're the same)."
law,"How do small-town and small-city lawyers avoid conflicts of interest?.How do rural, small town, or even attorneys in smallish cities that aren't near larger cities avoid conflicts of interest? It would seem that it wouldn't take long for those to develop with a small pool of potential clients."
law,"What speed do you officers drive?.Like driving on the highway or residential, do you go 4-7 over like everyone else on the residential or keep it steady right on the limit? I've always wanted to know. I've been on a couple ride-alongs but always forget to look at the speed."
law,"Anyone with Michigan State Police.Hey, I'm going through the MSP hiring process, and I'd like some more information about what to expect in the interview.  Maybe some specific questions or what they'd like to see in my answers. "
law,"Refused to speak to the police after an officer got assaulted. Did I break the law?.I witnessed a police officer being assaulted in a nightclub on Tuesday. I don’t like the police and so when they were stopping people to check for witnesses I said first “no comment” and then later “I don’t speak to the police.”

I know lying to the police is an offence, but can you refuse to help them with their enquiries on the grounds that you don’t want to?"
law,"Meal break NY.Just trying to find a quick response to my question vs looking up labor laws. Can my manager schedule a time for breaks depending on the needs of the business? For example I work from 10:45am-7pm and she wants to schedule my 1 hour break at 1pm which I feel is too early, is this allowed?"
law,"How would this Better Call Saul Scene play out in real life?.Better Call Saul has a lot of moments that are pretty unbelievable when it comes to happening in the courtroom, but I'm curious about this one. How would this play out in real life? Is this legal to do? What implications could/would this have for the defense or prosecution?

&#x200B;

[https://www.youtube.com/watch?v=YCcq2BkxiaE&ab\_channel=ReShow](https://www.youtube.com/watch?v=YCcq2BkxiaE&ab_channel=ReShow)"
law,"If someone threw 2 strangers in a pit and threatened to let them both starve unless one of them killed the other, would the survivor have to do time?."
law,perjury question.Is it true that one cannot be convicted of perjury if they retake the stand and change their testimony?
law,"Is there any US case law on a 1A right to silence?.The fifth amendment doesn't apply to LEO requests for identification and courts may draw a negative inference if invoked in civil matters, but what about the first amendment and silence as symbolic speech? I think that reserving the ability to compel testimony is a compelling governmental interest, but has it ever been litigated?"
law,"Potential Harassment by a Glazing Company.We have used a glazing company for a mirror and kitchen splashback. They messed up the order a couple of times and when highlighting this in their email to request completion of payment they replied: 
“She’s just after a discount the cunt” 
“She’s off her head isn’t she.” 

It was clearly meant as an email between them but it was sent to us. 

Is there any case for harassment there? Anything else that can be done?
This case is in England"
law,"Being asked to Email ""resignation intention"" to my boss..Being asked to Email ""resignation intention"" by my boss. Being done to ease workflow on others. Can this affect me.

&#x200B;

Also does my current employer have to give time off for me to complete DBS checks at a different place of work, in person."
law,Can my workplace ask me to cover someone else complete shift plus my own?.Can my workplace make me work someone complete job without extra pay? Whilst still doing my own work I read some where that taking on extra work with extra pay could cause me to go below the minimum wage?
law,"Paint on patio considered?.My dad and brother-in-law painted my back patio without my permission in government (military) housing. I understand that I might be responsible for it being cleaned up, hence why I'm removing it now. I just want to know if they can hem me up for damage to personal/government property for something like this. State is AZ and the hosuing entity is private/separate from military."
law,"When a police officer is the defendant in a criminal trial, can or do they appear in uniform in the courtroom?.Saw someone in an unrelated thread talking about how cops on trial will wear a perfectly pressed uniform to appear sympathetic to the jury. But I literally cannot ever recall seeing that when the officer is the defendant. It's always ""generic dark suit."" 

But I don't spend a ton of time watching trials either, so I thought I'd ask."
law,"Officers of Reddit, say someone’s house catches fire, and that person happened to be naked at the time and therefor has to run out of the house nude, can that person be charged with indecent exposure?."
law,"Is it true that the most police officers on shift during the day is swing shift?.Hello, a while back someone told me that ""the most police officers that are on shift at anyone given time during the day is swing shift between 4pm and midnight"" 

i'm curious, is this true? if so, why? 

thank you"
law,"Different stance on capital punishment before and after law school?.Did anyone's (especially criminal attorneys) stance on capital punishment change once you finished law school?

Or did it change after you'd been practicing for some time?

I'm not asking specifically what your stance is or was, I'm just curious if law school changed it?"
law,"Class action suit settled and I got a check.I don’t exactly recall the details but about a week ago I was sent my ‘share’ of a settlement check in a class action suit. About $18.00.  Do I cash this? I will admit because I don’t even remember the case, I’m worried it’s a scam and by cashing it, I link the senders bank info to my bank router info.  I get nervous I cash an $18.00 check I think is real and my acct gets hacked.  Does the FDIC insurance cover me for something like that anyway?"
law,Someone used my credit card to open onlyfans. Is there a way to find who that account belongs to?.
law,"Oklahoma Eviction Question.In Oklahoma, are land lords obligated to show before and after pictures of the apartment? My landlord is trying to charge me almost $300 for refinishing the bathroom tub they claimed was damaged. It had damages prior to move in. Unfortunately, try as I might I can't find the pictures I took on my phone of the tub. Thank you."
law,"Florida lawyers….could the case be made that based on the “Stop Woke Act,” all Theology and Religious Studies classes at public universities should be banned, since they fit the definition of “woke” to a T?."
law,"What problems would I face if I do not have a middle name?.I live in California and plan on changing my name soon. I do not want a middle name but I am wondering what legal and documentation problems I might face without one. Is it absolutely necessary for me to have a middle name, or may I forgo it without worry?"
law,If I chip my tooth could they get in trouble?.
law,"Is it true that the most police officers on shift during the day is swing shift?.Hello,  a while back someone told me that ""the most police officers that are on  shift at anyone given time during the day is swing shift between 4pm  and midnight""

i'm curious, is this true? if so, why?

thank you"
law,What is in paperwork to retain lawyer? read description I need info asap..Does anyone know what general paperwork and documents you sign to retain a lawyer for a disability appeal? Like for fees anything for social security. Legal agreements etc.
law,"Are items left on the side of the road fair game to be taken?.I work door to door sales and often times will see things left on the curb. Usually things like broken furniture, appliances, and other small things. Today I found a printer that appears to be in decent condition and is likely easily fixable. I just so happen to also need a printer. 

Am I able to take it? its not in front of anyones house, otherwise id knock their door and ask, its on the corner of the street.

Texas BTW"
law,"There is a 1 acre plot of land in the UK that was given to the USA in perpetuity by the Queen for a memorial to JFK. Whose laws would apply here?.I saw a video on the history of it and it made me wonder whose laws would apply? From my googling, the land is sovereign US territory. If someone were to commit a crime, would the laws of the US or UK apply? Who would prosecute them? Where would the trial take place? It seems like it would be a bit of a gray area."
law,Could I get a registered service dog if I live in a no pets duplex?.Hello. So I've been recommended getting a registered service dog. By my psychiatrist and therapist. I have absolutely horrible anxiety and panic attacks. They get very bad and it's very hard to function. But I live in place that no pets are allowed? But is there anyway I can get a service dog? If it's shown that I need one can my landlord still say no? I'm sorry if this is stupid I don't know much about this.
law,What can I mail my friend awaiting trial in Pinellas Co. FL jail?.I have a friend that got arrested in Pinellas Co. Florida. He’s awaiting trial on a burglary with assault charge. What am I allowed to mail him? Just a letter? Or can I send him paper or pencils or a book or the crossword or anything like that? Thanks.
law,Any reliable source/stats for law enforcement officer deaths/homicides in countries around the world? [Experiencing a great deal of trouble with locating this information.].
law,In what scenarios would a criminal defence lawyer request a Freedom-of-Information request from a Police Department and what type of information are they generally speaking?.
law,What are the best Richard A Epstein books for tort ?.
law,"I got my license plates stolen (California) i already reported to the police, but thats the only car i use and now i can not get to work..Im currently on hold with DMV.. is there anyway they give temporary license plates meanwhile the original come in mail? How does it work smh. Thanks guys"
law,"USA TX- Can I ask for the dna evidence in a case where I am the victim?.I was a victim in a stalking case and there was DNA evidence, is it possible for me to get this to use for testing?"
law,"Entering a home or property?.When is law enforcement  allowed to enter a home without permission or a search warrant? Does it make a difference if it is unlocked? 

How about someone's property? With or without a locked gate and with or without a 'No Trespassing' sign?"
law,(US) Validity of charging credit card surcharges?.A comment on a post on a different thread came up asking if it is legal for businesses to charge a fee for credit cards. I've heard both yea and nay on the topic.
law,"Navient Account Overdraw.Navient (student loan company) overdrew my SIL's bank account resulting in over $600 in overdraft and charges. She never gave them permission to withdraw from her account, and was under the impression that they would only withdraw %15 of her disposable income if any. She has no disposable income currently. Any advice on how to get her money back? Cross-posted in r/StudentLoans"
law,"[FR/EU] Legality of owning chemistry glassware.Title; I am interested in chemistry and am planning on buying glassware made for that purpose. Is some kind of justification, permit or anything required to buy Round-bottom flasks, test tubes, distillation ware , etc.. ?"
law,"Driving a car.So, my boyfriend doesn’t have his own car, but wants to borrow my car it’s insured. Can he drive it without getting in trouble? He has a valid drive license, he does have a dui on his record but has his license back. He also has this insurance called sr 22 insurance, he’s scared he’ll get in trouble but my car is insured. So would he get a ticket for driving my car? Also, I’m in California"
law,"If jury nullification is a fundamental right of the jury, why is it not allowed to be mentioned in the courtroom?.Also does a non-lawyer representing him or herself have more freedom to mention jury nullification?"
law,"[US] [Iowa] Can an employer have employees write an essay? And a question about holiday pay..To clarify, if an employee misses a mandatory staff meeting for any reason, that employee will need to write a 1-page essay or...something happens (this part was unclear).

As for holiday pay, the rule is that an employee must work their scheduled shift before and after a holiday to qualify for holiday pay. Can employers do that?

Thanks for any answers!"
law,"Why do prosecutors sometimes duplicate murder charges against a defendant, and most times they don’t?.Aroura CO, theater mass murderer, James Eagan Holmes, killed 12 people and prosecutors charged him with 24 counts of murder. NY limo driver Nauman Hussain killed 20 people in a limo accident. He’s been charged with 40 counts of murder. 

Why is this done, and if for good reason, why is it done so infrequently?"
law,do you have a work-related superstition?.What is it? How did it start? How serious about it are you?
law,"Responsibility of the Trustees of the Trust to disclose information to the beneficiaries.What are the responsibilities of Trustees to disclose information of the Trust to beneficiaries as they proceed to wind down the Trust. This is in Canada. There is a bank account (investments) owned by the Trust, and property. Do they need to provide regular updates, and timelines?"
law,"In US, can you file an affidavit.For a distant relative?? Having trouble getting info on google!"
law,"Conservative voters want candidates that will appoint conservative judges. Liberal voters want candidates that will appoint liberal judges. Yet the law is the law. Does a judge’s political ideology actually matter?.When a judge is there to interpret and apply the law, how would their political leanings affect their ability to follow the law, fun a courtroom, call balls and strikes, or sentence the guilty?"
law,"Did it really happen?.My son's SO told him someone broke into their house and assualted her 3 weeks ago while he was out of town working. The story is very unusual and while I hate to say I don't believe it, I have serious doubts. Is there any way for me to verify that the incident actually took place? She claims the guy was arrested and made bail, and is facing 20 years to life."
law,"[US] Outside of the fictional ""Love Contract"", are there preventative measures that keep regrettable sex from becoming rape accusations?.https://youtu.be/mOoGuy8y7ec

Also what is the punishment for a false rape accusation?"
law,Looking for a firm to start a class action lawsuit.How do I do that?
law,Termination question.So hypothetically like purely hypothetical. if and employer tells and employee to do a highly unsafe act that if it goes wrong could result in great bodily harm/loss of life. The employee refuses to do the job based on those grounds. The employer then decides to fire the employee for not doing the task. Is that legal?
law,"Why is it so bad to shop around for a lawyer?.I always here there’s an over abundance of attorneys, but not enough good attorneys. I’m sure y’all have stories for days about terrible attorneys. I mean the profession is stereotyped as being riddled with assholes. A bad attorney can really screw up a clients life, so why are good attorneys turned off by these clients?"
law,"Daily Mail used pictures I took of a friend, which they pulled from his Facebook account.As the title says. DM published an article against a close friend (he's doing okay so far). Anyway, they've pulled a couple of his profile pictures from Facebook, which I took. The article will also be printed tomorrow, no idea on picture use yet.

He said jokingly that we should invoice them.

Can we?"
law,Do you believe any of your clients have been found not guilty because the jury nullified?.
law,"I know that if a company refuses to transact with you or allow you to do something, that's ok, it's their business, but what if it is at the behest of the US Government? Could that be a constitutional violation?.I know that if a company refuses to transact with you or allow you to do something, that's ok, it's their business and their rules, but what if refusing to let you transact it is at the behest of the US Government? Could that be a constitutional violation?"
law,"Our pre-covid holiday refund. Advice needed..We bought a holiday, to Portugal in 2019. Due to covid-19, we were offered a refund or transfer. We asked for a refund but they didn’t have funds available at time. The company now claimed bankruptcy and we have no way of contacting or getting money back. We unfortunately were not ABTA protected. Could anyone advise us where do we go from here?"
law,"Is there a legal path to execution for trump?.I would like to see an example made of him, and was wondering what kind of charges would be needed for a legal execution? I remember hearing that treason might be punishable by death.

Also, I would like to see him buried at sea ala bin laden, if that is a possibility.

Thoughts?"
law,I need help.. I was caught with pills in Louisiana .. it is my first time ever being in trouble. The police test the pills which came back positive for fentanyl. But on the lab report they only test one . Is that normal or a mistake?.Help please
law,"Is it legal for a minor’s account in school gets tracked/wiretapped?.(backstory) I was sitting in my animation class when all of a sudden my music I was listening to cuts, I reload up my music, and the tab gets closed, then a few weeks later I search my school app, and it says blocked with a big fat handprint, I heard that there is a law about wiretapping, but is unsure if it affects this circumstance.


Edit: it is in Texas"
law,"DCBL after me for fine I didn’t accrue.Hi there,

I sold a car last year. It didn’t have a logbook so I told DVLA I sold it and the new owners applied for a logbook. Not sure what happened but they received a parking fine, and it’s in my name despite me not having owned the car at that point. It’s now been escalated to a CCJ on my credit report. I have proof in messages and received payment that the car was NOT mine. Is there anyway I can fight this?"
law,If I am 21 and decide to let my younger 17 year old brother throw a party and the police come is there anyway they can come in if I don't give permission?.I'm wondering about any and all situations where my permission would not be needed for them to enter. I may not be posting this in the correct place so if not please send me the correct direction! Also if you have any government documents backing up your answer I would greatly appreciate those.
law,"Who’s gun be that?!.My wife bought a gun for concealed carry but absolutely hates it and wants a different kind. It’s awesome (Springfield Hellcat 9mm with micro optic) and I would like it to be my daily carry firearm. If I’m playing by the rules, can I just use it/take ownership of it or do I need to go through another FFL transfer? 

State: Colorado"
law,"Do I legally need employers insurance for my LTD company..Hi everyone, based in England.

I set up a LTD company just over a year ago and it has been doing well. I’ve come to the position where I can finally pay myself a small salary.

I just wanted to know do I legally need employers insurance if I’m the only one working for the LTD company. There is no other staff. I do everything from opening to closing and everything else in between.

Thank you in advance."
law,"Are you allowed to share an SEC subpoena with others?.Curious, if you're allowed to share the contents of an SEC subpoena, or subpoena in general with others? It's not something the subpoenad is required to keep private, right?"
law,"Could the police raid my house while my mom is in rehab?.So I guess my mom has warrants, and is currently in rehab in another state. The police showed up to our house last night looking for her and asked to look around the house which we refused. We informed them she is in rehab, and gave them her phone number and address. Would they still get a warrant and search our house?"
law,help?. **this is for my English assignment for college. : she is worried. she lives in state A where the age of consent is 17 he lives in a state where the age of consent is 16 but has an age differential if it's 14 years of age with a 4 years age gap. if she travels over the state lines to have sex with her boyfriend is this legal? (m)15(f)18 can she be charged with rape?**
law,In the United States can one set up a 501c3 charity that will give the money that is donated to said charity to artists in order for them to create pubic art. And / public education videos to be posted on YouTube?.What are the key points?
law,"[California] - Where can I go to learn more about the law? Or are any lawyers willing to answer my questions?.I'm a writer who is working on a piece about a lawyer. I have a specific legal problem set up for him, but I am not sure how to solve that problem in a nuanced, realistic, and original way. Where can I study up about maybe real-world cases or interesting cases similar to mind?

Alternatively, would any lawyers here be interested in calling and discussing hypothetical legal situations?"
law,"AITA for questioning this situation?.I found out that a man who is now 25 was sexual (foreplay) with a 13/14 year old when he was 16. Then again sexual with them at 16 years old when he was 18. 

This is considered sexual assualt on a minor right? Possibly even grooming? The police did turn up at 2 of the boys house and they told the police they wasn't sexual with them years ago however that was a lie."
law,"Order of the Coif?.Any lawyers here awarded Order of the Coif? Is this something to shoot for / does it actually mean anything important? Feel like I see it in everyone's lawyer bios.

And what was your GPA? Top 10% seems so vague to me, curious what some numbers were."
law,"Ex threatening revenge porn.I have an ex who is threatening to share explicit photos that I sent them while we were in a relationship. I've blocked them and have tried to cut contact, but I was recently contacted through social media with what seemed like a fake profile who shared the photos with me in a dm. I have a feeling it's them, but I'm not sure how to prove it. Is there anyway that I can protect myself at this point?"
law,"(America) if a criminal confesses to their lawyer, does the lawyer have to tell the judge the accused confessed, or can the lawyer still plead not guilty?."
law,"Is it double jeopardy if I pay a moving violation from a camera and still have to pay a hand-written ticket for the same infraction?.One infraction resulted in two tickets, one from a camera system and one from an officer. The former is less expensive and has no points while the latter is twice as expensive and has points.

I am contesting both.

But what if I paid for the former and then claimed double jeopardy on the latter?"
law,"Wearing a dirk with highland dress.Near Edinburgh (in public) I saw someone who looked to be a tour organiser. He was wearing the ""full"" plaid and he had a dirk at his hip. 

Is this justifiable like the Sikh Kirpan? I know there are versions of the kirpan where it is permanently fixed inside the sheathe."
law,"Is the SRA 1984 (USA) still in power?.So I'm writing an assignment and wanted to use the abolishment of a parole from the Sentencing Reform Acr from 1984 an example for something. But I have trouble finding out if this law is still in power or was a new act created in the meanwhile? 

Thanks!"
law,"My gf is trying to transfer her moms camper trailer in her name.Her mom passed away leaving no will last year, and her brother who is currently in jail has taken over the trailer. My gf has the title and we want to get the trailer in her name. I found a form to transfer a motor vehicle without a will but does that apply to the trailer?"
law,Neighbor restraining order.What would happen if I got a restraining order for my next door neighbor? Would they be required to move or will they only be allowed near me if they're in their place?
law,"It came out that the special counsel has pierced attorney-client privilege for Trump. I know they would only do this if they strongly suspect a crime, but does that virtually guarantee charges?.It seems like if the DOJ pierces attorney-client privilege they'd have to bring charges, since there being a crime would be the reason they did it."
law,What state's maternity leave laws does a company have to follow when the employee lives in another state?.The employee's state? or the state the business is located?
law,"Is this true?.From [here](https://archive.ph/KKxJF#selection-389.0-392.0):
>Wisconsin Takes Action group paid voters $250 to encourage family and friends to elect far left judge. Paying people to vote for s specific candidate is against Wisconsin state law."
